article_id,title,year,month,source,byline,section,length,text,text_length,docx_file,match_method,frame_annotations,tone_annotations
Immigration1.0-34928,JUSTICES TO WEIGH CURB ON SCHOOL FOR ILLEGAL ALIENS,1981,5,new york times,Special to the New York Times,section b,596.0,"In a key test of the constitutional rights of illegal aliens, the Supreme Court agreed today to decide whether Texas can refuse to provide a free public education for their children.
The case involves the constitutionality of a Texas law, enacted in 1975, that cut off state reimbursement to local school districts for the costs of educating illegal alien children. Under the law, local districts could bar the children from school or could charge them tuition, an alternative that, given the poverty of most illegal alien families, had the same effect.
Supreme Court agrees to hear case regarding constitutionality of Texas law regarding free public education for illegal aliens
The Mexican-American Legal Defense and Educational Fund, on behalf of 16 children in the Tyler school district, challenged that district's imposition of a $1,000 annual fee for each illegal alien child to attend its schools. At the time of the suit, there were about 40 Mexican children in the 16,000-student district.
Both the United States District Court and the United States Court of Appeals for the Fifth Circuit agreed with the children's attorneys that the Texas law violated the equal protection clause of the 14th Amendment. That clause forbids a state to ''deny to any person within its jurisdiction the equal protection of the laws.''

State Sees U.S. Responsibility
The state and the Tyler school district appealed to the Supreme Court. The case, Pyler v. Doe, No. 80-1538, has set off emotional debate throughout Texas, with state officials arguing that Texas should not be made to bear the financial burden of providing social services to those who are in the country only because of the Federal Government's failure to enforce the immigration laws.
The children's advocates argue that illegal aliens are welcome in Texas as a source of cheap labor and that many of them pay income, sales and property taxes. They cite the opinion of the United States Court of Appeals for the Fifth Circuit last October, in which Judge Frank M. Johnson wrote: ''Denying a person a basic education is tantamount to insuring that the person remains at the lowest socioeconomic level of modern society.''
No one appears to know how many illegal alien children of school age live in Texas. Estimates range from 20,000 to more than 100,000.  The fact that children born in this country are citizens, even if their parents are in the country illegally, complicates the task of estimating numbers. It also results in differing status for some children within the same family.

Fifth Circuit Opinion
The Supreme Court has never ruled on whether the equal protection clause applies to illegal aliens. The Fifth Circuit ruled that it does, with Judge Johnson writing that ''aliens illegally within this country are clearly persons within the jurisdiction of the state in which they reside and thus fall under the simple language of the 14th Amendment.''
In its Supreme Court appeal, the state argued that a person who is in the country illegally is technically not within a state's jurisdiction and is therefore not covered by the clause.
Because the scope of the 14th Amendment is central to the case, the Court's decision, expected sometime next year, could have a farreaching effect on the rights of illegal aliens in many contexts beyond public education.
When the case was before the Fifth Circuit last year, the Justice Department supported the children. The Reagan Administration has not yet taken a legal position in the case.
Classification


Language: ENGLISH
Subject: ILLEGAL IMMIGRANTS (92%); PUBLIC SCHOOLS (91%); SCHOOL DISTRICTS (91%); CHILDREN, ADOLESCENTS & TEENS (90%); CONSTITUTIONAL LAW (90%); EDUCATION & TRAINING (90%); EDUCATION SYSTEMS & INSTITUTIONS (90%); EQUAL PROTECTION (90%); LAW COURTS & TRIBUNALS (90%); SUPREME COURTS (90%); APPEALS (89%); APPEALS COURTS (89%); APPELLATE DECISIONS (89%); JUDGES (89%); JURISDICTION (89%); DECISIONS & RULINGS (78%); IMMIGRATION LAW (78%); IMMIGRATION OF MINORS (78%); NEGATIVE NEWS (78%); NEGATIVE POLITICAL NEWS (78%); NEGATIVE SOCIETAL NEWS (78%); TUITION FEES (78%); US STATE GOVERNMENT (78%); FAMILY (77%); PUBLIC OFFICIALS (77%); HISPANIC AMERICANS (74%); GOVERNMENT & PUBLIC ADMINISTRATION (73%); IMMIGRATION (73%); PROPERTY TAX (72%); US FEDERAL GOVERNMENT (72%)
Company: SUPREME COURT (US)  UNITED STATES COURT  (55%)
Organization: UNITED STATES COURT  (55%); SUPREME COURT (US)  UNITED STATES COURT  (55%)
Industry: PUBLIC SCHOOLS (91%); EDUCATION SYSTEMS & INSTITUTIONS (90%); PROPERTY TAX (72%)
Geographic: TEXAS, USA (97%); UNITED STATES (94%)

End of Document",4607,downloads\batch_01\JUSTICES TO WEIGH CURB ON SCHOOL FOR ILLEGAL ALIENS.DOCX,filename,"{""annotator0"": [5, 6], ""annotator13"": [5], ""annotator5"": [1, 5, 11], ""annotator9"": [1, 5, 6, 13], ""annotator8"": [5]}","{""annotator9"": [""pro""], ""annotator1"": [""pro""], ""annotator14"": [""neutral""], ""annotator15"": [""neutral""]}"
Immigration1.0-34319,"LOS ANGELES,ALMOST 200,RANKS NO.2 AMONG CITIES",1980,9,new york times,By ROBERT LINDSEY,section a,1508.0,"At the age of 199, it appears, Los Angeles has become No. 2.  This sprawling city began a yearlong bicentennial celebration this weekend that will culminate with the commemoration of the 200th anniversary of its founding by 44 immigrants from Mexico on Sept. 4, 178l.
As the civic celebration was beginning, preliminary estimates from the 1980 Census were released indicating that Los Angeles was now the nation's second most populous city, eclipsing Chicago, which had held that distinction since 1890 when it passed Philadelphia to become the ''Second City.''

Role of Mexican Immigrants
While few people dwelled on the matter, there was a pattern in the turn of events: Los Angeles, a city founded by Mexicans, appeared to have become the country's second largest city largely because of a renewed wave of immigration from Mexico.
And as it began its bicentennial year, Los Angeles appeared to be on its way to becoming the nation's first city where a majority of the population is made up of immigrants from Latin America and Asia or descendants of earlier immigrants from those regions of the world and Africa.
AN-A
This city is still the Los Angeles of freeways, movie stars, earthquakes, palm trees and smog, of experimental ways of life and unorthodox religious cults and a seemingly omnipresent, benign sun.

Autos and Real Estate
It remains perhaps the quintessential American urban expression of the automobile, a city that seems to have been experiencing a real estate boom continuously since the first land developers and hucksters came from ''back East'' a century ago and began to turn a sun-blessed semidesert into one of the world's largest metropolitan regions by importing water from mountain ranges 300 miles away.
It is the economic center of a region containing more than 10 million people that in the last decade has become the nation's major financial bridge to Asia, a visibly thriving city whose downtown is currently experiencing a rejuvenation involving more than $1 billion worth of new construction.
It is a cultural center that not only produces most of the world's movies and prime-time television programming but, increasingly, exports original plays to Broadway, has a world-class symphony orchestra whose musical director, Zubin Mehta, was recruited by the New York Philharmonic, and is the setting for a planned major museum of contemporary art that promises to be one of the most ambitious museum projects in any American city in decades.

Annual Gathering of Migrants
Every summer, a 45-year-old southern California ritual recurs, when some of the tens of thousands of migrants who moved west from Oklahoma, Texas, Iowa, Nebraska and elsewhere in the 1930's gather at picnics to talk about old times.
But each year, there are fewer people at those picnics, because some of the migrants have died and others have decided to move out of California to escape the smog and congestion.
To fill their places, there is a new wave of migrants. Los Angeles is still attracting people from other states, especially New York.  But more and more, local officials say, the newcomers are from other countries.
''It's becoming a Hispanic city,'' said Charles Drescher, director of the city's Community Analysis and Planning Division, which has estimated that the 1980 Census will show that non-Hispanic whites now make up 44 percent of the population, as against 59 percent in 1970 and 72 percent in 1960.
But he said that the changes went beyond the tide of immigrants from Mexico and other Latin-American countries who have been propelled northward by economic deprivation and have changed the look and texture of life here.
He predicted that the census would also document a sizable influx of immigrants from Taiwan, Korea, Vietnam, Cambodia and other thirdworld countries in the 1970's.  According to the local population researchers, it is this Latin and Asian immigration, occurring in a decade when more than one million non-Hispanic whites have left the city, that has allowed Los Angeles to challenge Chicago for the position of the country's second largest city, after New York.
Although both cities are contesting the figures as too low, the preliminary Census Bureau data indicate that Los Angeles now has about 152,000 more residents than Chicago. The figures show Los Angeles with a population of 2,878,039, about 62,000 more than in 1970, and Chicago withh a population of 2,725,295, about 644,000 fewer than in 1970.

Breakdown of Population
The city's most recent estimates indicate that whites make up 44 percent of the population; blacks, 21.5 percent; Hispanic residents 28 percent and Asians and Pacific islanders about 7 percent.
The median age of the Hispanic residents is about 19, and the rate at which they are increasing, through childbirth and immigration, has prompted some researchers to predict that Latins could account for more than half of the city's population by the end of this decade. By the year 2000, they say, the Hispanic influx could make Los Angeles the nation's largest city. Hispanic pupils already make up almost 40 percent of the student enrollment here.
The Spanish-speaking immigrants are becoming increasingly important economically here, supporting not only retailing establishments but providing the labor for a large garment industry, much of it operating in sweatshop conditions. The large Latin population is also economically vital to the city's school system, whose white population has plummeted in recent years.
The Latin residents have not yet translated their numbers into political strength, but many people say they soon will.  ''It's only a matter of time - it's already begun,'' Grace Montanez Davis, a Chicano, who is an aide to Mayor Tom Bradley, a black, said recently in an interview.

Rivalry With New York
Although this is a city with a long history of self-promotion and civic boosterism, the news that it appears to have passed Chicago in population is not likely to bring much local applause. Many people here already believe that they live in the Second City and have considered New York as their natural rival.
According to some observers, many Angelenos, as the people here call themselves, have a kind of collective municipal inferiority complex. They say this is especially true regarding New York City's image of supposedly superior cultural riches and greater economic importance, in contrast with Los Angeles's reputation as a kind of vast, shallow tinsel town - ''19 suburbs in search of a city,'' as several generations of Eastern writers have depicted it.
The differences in reputations seems especially to trouble many of the New Yorkers who have moved here. A study by the Security Pacific Bank last year indicated that about 16 percent of this region's new residents in 1979 came from New York State.
For many displaced New Yorkers, a move here results in a kind of love-hate relationship involving the two cities, and they seem to be forever debating the cities' relative merits. Many of them have been known to return to New York for quick visits to confirm their decision to move here, or to import items, ranging from Nedick's orange soda to New York pastrami, for comfort.

Neil Simon's Solution
Neil Simon, the playwright, moved here five years ago after tiring of New York's problems but now divides his time between this city and Manhattan. Recently he decided to try out his next play outside Los Angeles because of his dissatisfaction with reviews in The Los Angeles Times.
Sandy Fox, a Brooklyn-born lawyer, holds a party each year at which 100 or so former New Yorkers nostalgically play stickball and other games from their childhood.
Reflecting on the dispute over the cities' respective cultural values, Gordon Davidson, a former New Yorker who runs this city's respected Mark Taper Forum, an innovative theater organization here, said:
''I'm bored with it. It's a silly argument. There's the problem of geographic sprawl, but there is a lot of activity that's bubbling here in many areas in the performing as well as the visual arts. The cultural situation in Los Angeles is different than it is in the East. The East looked to, and benefited from, the cultural heritage of Europe, but it's also been weighed down with it. Here we can benefit from the things that occur on the Pacific rim and take advantage of our Mexican and Hispanic influence.''
The bicentennial observance will include more than 150 community projects, ranging from art shows to the commissioning of a ballet and plays that stress the city's history. Angelenos are trying to use the event to enhance the city's image. Admittedly inspired by the imagebuilding power of the ''I Love New York'' slogan, the bicentennial planners devised their own slogan: ''L.A.'s the Place.''
Margo Albert, the wife of Eddie Albert, the actor, is co-chairman of the celebration. ''This will be a fine opportunity to show that Los Angeles is a great city instead of 'tinsel town,' and all that flaky stuff,'' she said.
Graphic


Illustrations: Photo (Page B8)
Classification


Language: ENGLISH
Subject: IMMIGRATION (91%); ANNIVERSARIES (90%); HISPANIC AMERICANS (90%); CITY LIFE (89%); CLASSICAL MUSIC (89%); CITIES (78%); EXPORT TRADE (78%); IMPORT TRADE (78%); LAND USE & DEVELOPMENT (78%); CENSUS (76%); ACTORS & ACTRESSES (71%); CELEBRITIES (71%); CULTS & SECTS (70%); CUSTOMS & CULTURAL HERITAGE (65%); RELIGION (65%); MUSIC GROUPS & ARTISTS (64%); ORCHESTRAS (64%); MOUNTAINS (50%)
Company: SECOND CITY COMMUNICATIONS  (57%); SECOND CITY COMMUNICATIONS  (57%);    BUREAU OF THE CENSUS  (60%)
Organization: BUREAU OF THE CENSUS  (60%); BUREAU OF THE CENSUS  (60%)
Industry: REAL ESTATE (90%); MUSEUMS & GALLERIES (89%); ACTORS & ACTRESSES (71%); CELEBRITIES (71%); MEDIA CONTENT (66%); CONSTRUCTION (65%); LAND SUBDIVISION (65%); MUSIC GROUPS & ARTISTS (64%); ORCHESTRAS (64%); TELEVISION PROGRAMMING (60%); PRIMETIME TELEVISION (50%)
Geographic: LOS ANGELES, CA, USA (94%); CALIFORNIA, USA (79%); IOWA, USA (79%); NEBRASKA, USA (79%); TEXAS, USA (79%); MEXICO (94%); ASIA (92%); LATIN AMERICA (79%)

End of Document",10101,"downloads\batch_01\LOS ANGELES ,ALMOST 200,RANKS NO.2 AMONG CITIES.DOCX",content,"{""annotator5"": [11], ""annotator9"": [11]}","{""annotator18"": [""neutral""], ""annotator14"": [""pro""]}"
Immigration1.0-34303,MEXICO'S COUNT OF MIGRANTS IN U.S. IS LOWER THAN OTHERS,1980,10,new york times,"By ALAN RIDING, Special to the New York Times",section 1,958.0,"A three-year Mexican Government study of migration has calculated the number of Mexicans living illegally in the United States to be far fewer than previously estimated.
The study puts the figure at 480,000 to 1.22 million, depending on the season. This contrasts sharply with the Nixon Administration's frequent talk of six million to 12 million ''illegals'' and the Carter Administration's more cautious estimate of three million to six million.
The study, which involved four separate surveys and almost 150,000 interviews, also found that most undocumented migrants cross the United States border with the intention of returning to Mexico within a few months.
AN-A
The Mexican findings seem certain to be disputed as self-serving by the United States labor movement and other groups that maintain that illegal migrants are partly responsible for high unemployment in the United States. Some one million Mexicans were detained and returned to Mexico last year, although many were ''repeaters'' - migrants arrested several times before finally making it beyond the border region.

Earlier Estimates Disputed
United States census experts, however, have apparently endorsed the method used by the Mexican study. A United States select committee on migration, which must present policy recommendations to the Carter Administration early in January, has also taken note of the Mexican results in some of its preliminary reports.
''Earlier estimates were based either on tiny samples or on political prejudices,'' a Mexican demographer said. ''This is the first time a massive household survey has been carried out.''
After President Carter dropped his migration package, sent to Congress in August 1977 but never taken up in committee, the United States and Mexico agreed to exchange detailed studies of the migration phenomenon before analysis of a mutually acceptable policy.
But while the United States select committee concentrated on ways of preventing undocumented aliens from finding employment, such as the institution of a national labor identification card and sanctions against employers of ''illegals,'' Mexico's Labor Ministry study focused on the migrants themselves.

Interviews in Households
The first survey, in November 1977, involved the interviewing of some 10,000 Mexicans at United States-Mexican border crossings as they were returned here by the United States Border Patrol. Two similar surveys - in August 1978 and in May 1979 - covered 75,000 more Mexicans being ''voluntarily returned'' from the United States.
The principal study, however, consisted of detailed interviews in 58,000 households in scientifically selected rural and urban municipalities around the country. Information was collected on a total of 350,000 people.
Some of the results merely confirmed the findings of earlier studies. For example, more than half the Mexican migrants come from just four northern and central states - Guanajuato, Jalisco, Chihuahua and Zacatecas - while more than 50 percent head for California and some 20 percent for Texas.
Taken in December 1978 and January 1979, during a holiday season in Mexico, the household survey found only 405,000 Mexicans in the United States at the time, though analysts allowed that this was perhaps a conservative figure. The survey nevertheless confirmed the cyclical nature of the migration, particularly since only 28 percent of those absent had been away for more than a year.

Most Migrants Are Men
The overwhelming majority of migrants are men (only one in seven is a woman) and young (71 percent are between the ages of 15 and 34) although at least half the men and women are married and, as a group, leave an average of 3.29 people in Mexico dependent on their earnings in the United States.
Some United States studies have suggested that as much as $3 billion is sent or brought home by migrants each year, but the household survey questioned this figure. For those in the United States at the time of the interviews, it estimated annual remittances to Mexico of some $310 million.
One of the most interesting findings was that the migrants are not among the poorest and least educated of Mexicans. Although 78 percent come from rural areas, three out of four had a job before deciding to gamble on higher earnings north of the border.
Further, the migrants had a median education higher than the Mexican average - four years' schooling rather than the national average of 3.1 years. Some 14.4 percent had seven or more years' education. But because this fell far below the average education even of United States minorities, the Mexican analysts argued that the migrants were not competing for jobs with Americans.

Migrants Called Scapegoats
Although the final Mexican report is not due until next year, the preliminary findings hint clearly at the arguments Mexican officials will use in future negotiations on the subject with the United States.
''Illegal migrants are always used as a scapegoat when unemployment rises in the United States,'' a Mexican expert said, ''but we hope to show that there aren't as many migrants as people thought, that they generally don't want to stay in the U.S. and they don't take jobs from Americans.''
If President Carter is re-elected, the migration issue is expected to become a major topic of relation with the Unitewd States. If he is not, however, Mexicans officials are hopeful that elaboration of a new United States migration policy will be indefinitely postponed.
Graphic


Illustrations: map of Mexico
Classification


Language: ENGLISH
Subject: ILLEGAL IMMIGRANTS (92%); BORDER CONTROL (89%); INTERVIEWS (89%); POLLS & SURVEYS (89%); TERRITORIAL & NATIONAL BORDERS (89%); ARRESTS (78%); LAW ENFORCEMENT (78%); NEGATIVE PERSONAL NEWS (78%); CENSUS (77%); NEGATIVE EMPLOYMENT NEWS (77%); UNEMPLOYMENT RATES (77%); HOUSEHOLD NUMBERS (75%); LABOR DEPARTMENTS (68%)
Company: US CENSUS BUREAU   (52%)
Organization: US CENSUS BUREAU   (52%); US CENSUS BUREAU   (52%)
Person: JIMMY CARTER (76%)
Geographic: MEXICO CITY, MEXICO (79%); CALIFORNIA, USA (79%); MEXICO (99%); UNITED STATES (97%); NORTH AMERICA (79%)

End of Document",6133,downloads\batch_01\MEXICO 'S COUNT OF MIGRANTS IN U.S. IS LOWER THAN OTHERS.DOCX,content,"{""annotator3"": [11], ""annotator6"": [1, 7, 11, 13]}","{""annotator15"": [""neutral""], ""annotator3"": [""neutral""]}"
Immigration1.0-34977,"Miami Businessman, Cuba-Born, A Contender for Immigration Job",1981,2,new york times,Special to the New York Times,section 1,129.0,"A Miami businessman emerged yesterday as a leading candidate for the position of Commissioner of the Immigration and Naturalization Service.
Jose Manuel Casanova, businessman from Miami (Fla), possible candidate for position of Commissioner of Immigration and Naturalization Service
Jose Manuel Casanova, 50 years old, who was born in Cuba and came to the United States in 1960, confirmed that he had discussed the position with officials in the Reagan Administration, but he declined to give details. White House aides have been promising that Hispanic Americans would soon be named to several major posts.
Mr. Casanova, reached at his home, said that he was once president of the Flagship National Bank of Westland, Fla., and was now president of Agro-Com Export, which exports food and medicine to Latin America.
Classification


Language: ENGLISH
Subject: IMMIGRATION (92%); IMMIGRATION LAW (90%); US FEDERAL GOVERNMENT (90%); US PRESIDENTS (76%); HISPANIC AMERICANS (73%)
Company: NATIONAL-BANK AG   (57%);  NATIONAL BANK LIFE INSURANCE CO  (57%);  NATIONAL BANK FOR DEVELOPMENT  (57%);  NATIONAL BANK SECURITIES INC  (57%);  NATIONAL BANK FINANCIAL  (57%);  NATIONAL BANK FOR INDUSTRIAL & TOURISTIC DEVELOPMENT  (57%); NATIONAL-BANK AG   (57%);  NATIONAL BANK LIFE INSURANCE CO  (57%);  NATIONAL BANK FOR DEVELOPMENT  (57%);  NATIONAL BANK SECURITIES INC  (57%);  NATIONAL BANK FINANCIAL  (57%);  NATIONAL BANK FOR INDUSTRIAL & TOURISTIC DEVELOPMENT  (57%);    IMMIGRATION & NATURALIZATION SERVICE   (91%);  IMMIGRATION & NATURALIZATION SERVICE  (91%)
Organization: IMMIGRATION & NATURALIZATION SERVICE   (91%);  IMMIGRATION & NATURALIZATION SERVICE  (91%); IMMIGRATION & NATURALIZATION SERVICE   (91%);  IMMIGRATION & NATURALIZATION SERVICE  (91%)
Geographic: MIAMI, FL, USA (91%); FLORIDA, USA (91%); UNITED STATES (93%); LATIN AMERICA (77%)

End of Document",1866,"downloads\batch_01\Miami Businessman, Cuba -Born, A Contender for Immigration Job.DOCX",content,"{""annotator4"": [1, 11, 13], ""annotator9"": [1, 11]}","{""annotator14"": [""pro""], ""annotator3"": [""pro""]}"
