article_id,title,year,month,source,byline,section,length,text,text_length,docx_file,match_method,frame_annotations,tone_annotations
Immigration1.0-34846,'We've Lost Control of Our Borders',1981,8,new york times,,section 4,599.0,"After several false starts, President Reagan has finally proposed his immigration reform. But the package is so disappointing one wonders what took so long. Key features are seriously flawed, almost ludicrously in the matter of regulating immigrant labor. Congress will not find it helpful in drafting legislation. And it displays an Administration so irresolute that it raises doubts about whether whatever Congress enacts will be fairly and vigorously enforced.
Editorial discusses President Reagan's proposed immigration reforms and expresses disappointment in key features regulating immigrant labor
Some facts are faced squarely. We have, as Attorney General Smith concedes, ''lost control of our borders.'' Uncounted millions cross our porous borders in search of a better life. Like prior immigrants, many enrich our land with industry. But their numbers are so great that they also strain community resources and threaten the jobs and well-being of those who preceded them.
Another bow to reality is Mr. Smith's concession that millions of illegals are here to stay and that some system has to be found to legitimize and integrate them.
But if the borders can't be closed, the key to control is jobs. A law that prohibits the employment of illegal aliens is a recognized necessity. But it will be a new mockery if Congress, like the Administration, flees from sufficient punishment for violators and from a realistic, fair way to detect violations.
Employers cannot be held accountable for whom they hire without a reliable way of verifying the immigration status - whether that be a forgery-proof Social Security card or some less expensive tool. An expert immigration commission recognized that fact, as did a White House task force. But for diverse reasons, including a misplaced concern over this extra measure of business regulation, the
Reagan Cabinet rejected the idea.  The emptiness of the proposed sanctions against employers is further betrayed by the proposed maximum penalty of $1,000 for each illegal hire - a mild cost of acquiring workers at many thousands below scale. Moreover, Mr. Smith would let employers avoid penalty altogether if they merely ask for such easily forged instruments as a driver's license and paper Social Security card.
By posing a costly and ominous-sounding ''national identity card'' as the only alternative, the Administration stacks the deck. Less expensive techniques are available, including a computer system of telephone verification. The President's concern for
''our values of individual privacy and freedom'' is welcome, but out of context. Forgery-proof identification need not invade privacy; but the lack of it could cost legal aliens their livelihoods.  Cynical employers can easily mask their discrimination against
Hispanics and other minorities by claiming uncertainty about immigration status.  Some sympathy is warranted for anyone who must wrestle with this vexing problem. All the issues - the nature and strength of border patrols, the intercepting of unwanted immigrants at sea, the standards for choosing refugees, the utility of an ''experiment'' in temporary guest worker employment - are mined with controversy and expense.
But it is hard to sympathize with an effort that failed so clearly on a central point. And if a dozen Cabinet officials can't reach accord on sound recom-mendations, what hope for 500 members of Congress?
Classification


Language: ENGLISH
Subject: BORDER CONTROL (99%); EDITORIALS & OPINIONS (99%); IMMIGRATION (93%); ILLEGAL IMMIGRANTS (90%); IMMIGRATION LAW (90%); IMMIGRATION REFORM (90%); IMMIGRATION REGULATION & POLICY (90%); REPORTS, REVIEWS & SECTIONS (90%); COUNTERFEITING & FORGERY (89%); NEGATIVE NEWS (89%); SOCIAL SECURITY (89%); US PRESIDENTS (89%); FOREIGN LABOR (78%); MINORITY GROUPS (78%); NATIONAL IDENTITY CARDS (78%); TERRITORIAL & NATIONAL BORDERS (78%); DISCRIMINATION (77%); LEGISLATION (77%); NEGATIVE SOCIETAL NEWS (73%); INVASION OF PRIVACY (71%); PRIVACY RIGHTS (69%); LAWYERS (68%); ATTORNEYS GENERAL (55%)
Industry: IDENTITY SECURITY (68%); LAWYERS (68%); ATTORNEYS GENERAL (55%)
Person: RONALD REAGAN (89%)

End of Document",4155,downloads\batch_01\'We've Lost Control of Our Borders'.DOCX,filename,"{""annotator7"": [1, 5, 6, 7, 8], ""annotator6"": [1, 2, 4, 5, 6, 7, 8, 10, 13]}","{""annotator3"": [""anti""], ""annotator4"": [""anti""]}"
Immigration1.0-34967,A Federal Jury Indicts 2 In Immigration Scheme,1981,2,new york times,,section b,222.0,"A Federal immigration investigator and a Long Island businessman were indicted yesterday on charges involving an immigration-fraud scheme in which the investigator allegedly sold his influence to help foreigners enter or remain in the United States. Law enforcement officials said the indictment was an indirect outgrowth of the Abscam investigation of corruption.
Federal immigration investigator and Long Island businessman are indicted in immigration-fraud scheme
A second businessman was cited as an unindicted co-conspirator in the alleged scheme. The 15-count indictment was handed up by a Federal grand jury in Brooklyn. The prosecutor in the case, Laura A.  Brevetti, said the three men had been promised a total of $15,800 in payments and had received $7,300 from various foreigners who were aided.
The defendants were identified as Gerard W. Gentile, 33 years old, of Commack, L.I., an investigator for the Immigration and Naturalization Service, and Manuel Horacio Lima de Jesus, 40, of Great Neck, L.I., the businessman. The unindicted alleged coconspirator was identified as Dieter Schmidt, 36, a former businessman now living in Florida.
At their arraignment in Federal Court in Brooklyn last night, Mr.  Gentile and Mr. de Jesus pleaded not guilty and were released pending further court proceedings.
Classification


Language: ENGLISH
Subject: IMMIGRATION (92%); INDICTMENTS (91%); CRIMINAL INVESTIGATIONS (90%); FEDERAL INVESTIGATIONS (90%); FRAUD & FINANCIAL CRIME (90%); INVESTIGATIONS (90%); JURY TRIALS (90%); NEGATIVE NEWS (90%); NEGATIVE PERSONAL NEWS (90%); CONSPIRACY (78%); CORRUPTION (78%); CRIME, LAW ENFORCEMENT & CORRECTIONS (78%); GRAND JURY (78%); LAW COURTS & TRIBUNALS (78%); LAW ENFORCEMENT (78%); LITIGATION (78%); NEGATIVE MISC NEWS (78%); US FEDERAL GOVERNMENT (78%); PUBLIC PROSECUTORS (73%)
Company: LONG ISLAND UNIVERSITY   (91%);  LONG ISLAND UNIVERSITY  (91%)
Organization: LONG ISLAND UNIVERSITY   (91%);  LONG ISLAND UNIVERSITY  (91%); LONG ISLAND UNIVERSITY   (91%);  LONG ISLAND UNIVERSITY  (91%)
Industry: PUBLIC PROSECUTORS (73%)
Geographic: FLORIDA, USA (79%); UNITED STATES (79%)

End of Document",2147,downloads\batch_01\A Federal Jury Indicts 2 In Immigration Scheme.DOCX,filename,"{""annotator6"": [5, 7], ""annotator10"": [7]}","{""annotator18"": [""anti""], ""annotator3"": [""anti""]}"
Immigration1.0-35240,A HELPING HAND FOR THE HAITIANS; Passaic resident is filling the role of honorary consul,1982,3,new york times,By DIANE FISKE,section 11,673.0,"PASSAIC TO Jean Claude Levy, honorary consul of Haiti in New Jersey, his title is not merely decorative. Rather, Mr. Levy, who is not a Haitian, sees himself as helping the thousands of Haitian immigrants in New Jersey who live in poverty. He considers his mission as one of assisting them in settling in a school or job.
The 38-year-old Mr. Levy lives at 110 Main Street here. He runs a secretarial school in East Orange called the First School, which teaches language skills in French and Spanish as well as typing, shorthand and the use of business machines. Many of his students are Haitian or Cuban.
Profile of Claude Levy, honorary consul of Haiti in New Jersey
Mr. Levy was born in Morocco and is still a French citizen. He first saw Haiti in 1971 while on his honeymoon.  ''My American wife and I looked at a map of the Caribbean - and there was Haiti,'' he recalled. ''I said, 'Let's have an adventure,' so we went to Haiti.
''It was love at first sight. I felt that, in many ways, Haiti is like Morocco. The climate and the people are very similar. The people are themselves and exist independently of the political climate.''
Noting that Haiti is only 70 miles from Cuba, Mr. Levy said he did not think that the United States should ''overlook a friendly country so close to its border.''
According to Mr. Levy, his secretarial school is the only American school with branches both in the United States and Haiti.  The status of many Haitians lies somewhere between immigrant and refugee, for the situation there does not present a sufficient emergency to permit them to be classified as people who have fled to avoid persecution.
Each Haitian must be granted asylum on an individual basis.  ''Many of these people are waiting for their standing to be determined before they register their children in American schools,'' Mr. Levy said. ''Meanwhile, they themselves cannot find work.''
Since September 1980, when he was appointed honorary consul, Mr.  Levy has been working with Representative James J. Florio, Democrat of Runnemede; Representative Peter W. Rodino, Democrat of Newark, and other members of the New Jersey Congressional delegation. They have been trying to get support for legislation that would allow Cuban and Haitian immigrants to be able to convert to permanent resident alien status after two years in this country.
Mr. Levy, who said that New Jersey's Haitians - they are second in number only to those in Florida and New York City - would like to establish a Haitian civic center in East Orange.
The center would acclimate the Haitians to American life and help them decide how to earn a living.  ''There is a need for schools in New Jersey to accommodate these Caribbean people,'' Mr. Levy said. ''I decided to take it upon myself in the mid-1970's to try to help educate these people, but there is much more to be done.''
Mr. Levy said that he traveled to Haiti 10 to 15 times a year and had conferred with President Jean-Claude Duvalier about the schools there.
''Haiti has the image of being a smiling, happy country where people are thinking poor,'' he said. ''We are trying to change that.''
According to a spokesman at the Haitian Embassy in Washington, many countries that cannot afford to establish consulates welcome people who wish to serve as honorary consuls.
An honorary consul cannot grant passports or carry out official duties. However, he can inform the public about the country he represents and help to establish a welcoming agency for people, such as Haitians, who arrive in this country.
''He (Mr. Levy) is there to promote Haiti in this country,'' the Haitian Embassy spokesman said. ''He was appointed by the ambassador as a non-full-time representative, and he seems to be doing a very good job of letting people know about Haiti.''
Graphic


Illustrations: photo of Jean Claude Levy photo of Kendall Franklin teaching Business English
Classification


Language: ENGLISH
Subject: IMMIGRATION (89%); REFUGEES (77%); STUDENTS & STUDENT LIFE (76%); NEGATIVE NEWS (72%); LEGISLATIVE BODIES (69%); POLITICAL ASYLUM (63%); POVERTY & HOMELESSNESS (57%)
Company: SICOME SA  (91%); SICOME SA  (91%)
Industry: SIC2329 MEN'S & BOYS' CLOTHING, NEC  (91%); EDUCATIONAL SERVICES (71%)
Geographic: NEW YORK, NY, USA (79%); NEWARK, NJ, USA (74%); NEW JERSEY, USA (97%); FLORIDA, USA (79%); NEW YORK, USA (79%); HAITI (99%); UNITED STATES (95%); CARIBBEAN ISLANDS (90%); MOROCCO (87%)

End of Document",4443,downloads\batch_01\A HELPING HAND FOR THE HAITIANS; Passaic resident is filling the role of honorary consul.DOCX,filename,"{""annotator3"": [5, 10], ""annotator11"": [10, 11]}","{""annotator3"": [""pro""], ""annotator11"": [""pro""]}"
Immigration1.0-35262,A STATE OF LIMBO RULES THE LIVES OF POLISH ALIENS,1982,2,new york times,BY SAMUEL G. FREEDMAN,section 11,1496.0,"WHEN the immigration agents approached Helena shouting, ''Polish?  Polish?'' she felt no surprise, only the confirmation of her worst fears. She knew she possessed neither the valid visa nor the work permit - for her $64-a-week job cleaning offices - that the agents wanted to see. ''There was a risk,'' the 40-year-old former bookkeeper said of her Oct. 21, 1981 arrest here. ''I just took it.''
Deportation proceedings against Helena, who asked that her full name not be used, began Dec. 22 - even though military law had been declared in Poland nine days earlier. The proceedings will continue although the Reagan Administration, in the wake of the recent events in Poland, has barred the actual expulsion of illegal Polish aliens until March 31.
It is a strange sort of deliverance, Helena said; military rule, the very act that saves her from the possibility of a forcible return to Poland, makes her dread it even more. She feels, she said, that she has no country.
Discussion of deportation of Polish-illegal aliens in US
Helena's sense of limbo is shared by about a thousand illegal Polish aliens living, working and often hiding, in Connecticut, according to Ryszard S. Mrotek, a Hartford lawyer who specializes in immigration cases. Estimates of their number nationwide range from 20,000, according to Aloysius A. Mazewski, president of the Polish-American Congress, to 35,000, according to Richard W. Day, general counsel of the United States Senate Subcommittee on Immigration, Refugees and International Law.
Some 5,300 Poles nationwide currently are involved in ''expulsion proceedings,'' including detainment, deportation hearings, decisions on requests for asylum and denial of entry to the country, according to Duane Austin, an information officer for the United States Immigration and Naturalization Service. He added that many of the illegal aliens also break labor, Social Security and tax laws by working ''off-the-books'' jobs - those that are not reported to Government officials.
Most Polish aliens first enter the United States on tourist visas, which last no more than six months, said immigration officials and Polish-American advocates. They generally live with relatives in the Polish enclaves of New Britain, Hartford, Stratford and large towns in Connecticut, although the greatest numbers are found in Chicago, Detroit and Pittsburgh. They work in relatively menial jobs - machine shops for men, garment factories or building maintenance for women - although the Poles range from unskilled workers to those with advanced degrees but no fluency in English. Most limit their movements to the passage from home to job, trying to avoid the periodic roundups made by immigration agents.
A suit brought by the Connecticut Civil Liberties Union, now in the pretrial stages in Federal District Court in Hartford, seeks an injunction against the ''random'' raids.
''Our people live like hunted game,'' contended Mr. Mrotek, a naturalized Pole. ''You stay as close as possible to the family, don't socialize much, don't talk at work, hide behind someone else's Social Security card, don't get a driver's license.''
The situation for Polish aliens changed significantly when Congress passed the Refugee Act of 1981. Until then, immigrants from Communist countries automatically received the status of refugees, allowing the influx of Poles and Soviet Jews in particular, Mr. Day said.
The new law, adopting verbatim the wording of a United Nations protocol, altered the definition of a refugee to a person with ''a well-founded fear of persecution, based on race, religion, national origin, or membership in any social organization.''
The definition appears to exclude most Polish aliens, Mr. Day said, because they came to the United States for economic gain.  ''What we hear about are food shortages, fuel shortages,'' he said, ''not political reasons.'' But Polish aliens rarely extricate the shortages from the Communist government that presides over the economy.
The existence of Solidarity further complicated the issue.  Immigration officials and lawmakers had pointed to the ascension of the independent trade union as proof of the absence of mass persecution in Poland, and deportations of illegal immigrants continued until the Dec. 13 declaration of martial law. On that day President Reagan ordered deportations halted, and the immigration service on Jan. 22 said no Poles would be returned home until at least March 31.
But expulsion hearings that began before Dec. 13 continue and the State Department has ''temporarily suspended consideration'' of requests for asylum, according to a letter to Mr. Mrotek from John D. Scanlan, deputy assistant secretary for European affairs. A blanket amnesty for Polish immigrants ''would be inconsistent with the Refugee Act,'' Mr. Scanlan wrote.
Senator Alan K. Simpson, a Republican of Wyoming who is chairman of the Senate immigration committee, said, ''We have to be very cautious about any broadening of the definition of 'refugee,' '' because, besides the Poles, thousands of Haitian and Salvadoran immigrants claim to have fled political persecution. He reiterated the wording from the Refugee Act, but then added, ''How do you deal with plain old fear?''
Mr. Simpson did not answer his own question. But Betty, a 32-yearold Polish alien living in Greenwich, could. She has lived ''underground'' - her word - for the seven years since her six-week tourist visa expired.
''I was simply hiding,'' she said. ''I couldn't take a job I'd like to, like an office job or nursing. I didn't get a driver's license.  I opened a savings account in my cousin's name.''
Betty said she tried several times to attain legal status, paying $1,000 to a lawyer who did not succeed in doing so, and seeking advice from Polish-American organizations. ''They told me, 'Immigration isn't looking for you, sit quiet,' '' she recalled.
But her conscience troubled her. Twice she bought airline tickets to Poland, only to return them. ''I feel very guilty about not paying taxes,'' she said, ''but I spend all my money here. I paid lawyers, I paid doctors, I was in the hospital and paid all my bills.''
She misses her family and blames herself because, she said, since her flight from Poland, her brother has been denied the right to work in Czechoslovakia and her father has been interrogated frequently by Polish officials.
Betty's mother, however, received a visa in December 1981 to visit Betty's aunt in Stamford. Then martial law was declared. Betty's mother wants to return home. Betty's aunt wants the 57-year-old woman to stay. Her visa expires this month.
Barbara, 29, a Polish immigrant in Hartford, also feels torn between family and freedom. She left her husband and children in Warsaw in June 1981 with the promise, ''See you in three months.'' Now she fears that returning to Poland means imprisonment because she had been a Solidarity organizer.
''I keep myself very busy,'' she said, ''or else I would go crazy.'' But work and her studies in computer science are not diversion enough. The strain of separation shows in the 15 pounds she has lost, the cigarettes she never before smoked.
One night recently, Barbara watched the movie, ''Man of Iron,'' which mixes a fictional plot with documentary footage of the Gdansk shipyard strike that gave birth to Solidarity.
''I feel how can this possibly be, that if I was there I would be in jail for my ideology,'' she said after the film. As the final credits slid off the screen, she looked at the spectators departing, and said: ''American people are nice, but they never can feel the same thing. It's not my country here. It never will be. I'm a stranger here.''
Barbara's problems, however, remain more emotional than legal. Her student visa and her affiliation with Solidarity - probably a boon in proving a ''well-founded fear of persecution'' and thus gaining asylum - are luxuries few other Polish aliens share.
Consider a 28-year-old seamstress in New Britain, who did not want to be identified. As she sat in her brother's apartment - legs drawn into her chest and locked into a defensive cocoon by linked arms - she told of the day of her arrest last June.
Three immigration agents came to her sewing machine in a New Britain factory, asking for her papers. She told them through an interpreter that she had a working permit and had applied for permanent residence, but did not have the documents with her.
The agents put her in their car. She thought they were taking her directly to the airport to be sent home. She went, in fact, to the Hartford immigration office for fingerprinting and mug shots, and then to the Connecticut Women's Correctional Institution in Niantic.  There she was held over night.
Her case remains in an immigration court. She contends that she has a valid work permit; immigration officials contend that she does not.  ''I can't go to Poland and I don't know if I can stay here,'' she said. ''The only choice is to look for another country.''
Graphic


Illustrations: photo of an unidentified Polish alien
Classification


Language: ENGLISH
Subject: DEPORTATION (90%); IMMIGRATION (90%); MILITARY & VETERANS LAW (90%); PASSPORTS & VISAS (90%); IMMIGRATION LAW (89%); CITIZENSHIP (78%); GOVERNMENT & PUBLIC ADMINISTRATION (78%); ILLEGAL IMMIGRANTS (78%); LEGISLATIVE BODIES (78%); MILITARY RULE (78%); NEGATIVE PERSONAL NEWS (78%); POLITICAL ASYLUM (78%); PUBLIC OFFICIALS (78%); US FEDERAL GOVERNMENT (78%); GARMENT WORKERS (77%); ARRESTS (76%); LITIGATION (76%); SUITS & CLAIMS (76%); PRELIMINARY COURT PROCEEDINGS (75%); INTERNATIONAL LAW (74%); LAWYERS (74%); US CONGRESS (74%); US PRESIDENTS (74%); REFUGEES (73%); INJUNCTIONS (70%); LAW COURTS & TRIBUNALS (70%); CORPORATE COUNSEL (69%); SOCIAL SECURITY (69%); TAX LAW (69%); HUMAN RIGHTS ORGANIZATIONS (68%); TAXES & TAXATION (65%); MANUFACTURING FACILITIES (61%)
Industry: PASSPORTS & VISAS (90%); JANITORIAL SERVICES (78%); GARMENT WORKERS (77%); LAWYERS (74%); CORPORATE COUNSEL (69%); MANUFACTURING FACILITIES (61%); APPAREL MFG (50%)
Geographic: HARTFORD, CT, USA (93%); PITTSBURGH, PA, USA (79%); CONNECTICUT, USA (94%); UNITED STATES (94%); POLAND (92%)

End of Document",10188,downloads\batch_01\A STATE OF LIMBO RULES THE LIVES OF POLISH ALIENS.DOCX,filename,"{""annotator1"": [1, 5, 7, 10, 11], ""annotator4"": [5, 7, 10, 11]}","{""annotator0"": [""pro""]}"
