article_id,title,year,month,source,byline,section,length,text,text_length,docx_file,match_method,frame_annotations,tone_annotations
Immigration1.0-35936,JUSTICE DEPT. CONSIDERS POSSIBLE APPEAL OF SENTENCES IN TEXAS SLAVE CASE,1984,2,new york times,By LESLIE MAITLAND WERNER,section 1,919.0,"The Justice Department said today that it was studying whether it could appeal what it considered excessively light sentences given to two Texas men convicted of holding 19 Mexican workers in slavery.
The men were convicted by a jury in Texas after testimony that they bought the aliens from a broker for $50 each, forced them at gunpoint to live in a tiny, unheated shack without windows or toilets, and made them work morning to night for no pay and little food.
The defendants, Steven Crawford and Randall Craig Waggnor, were convicted on more than a dozen counts, including conspiracy, transportation of illegal aliens, and forcing the aliens into involuntary servitude. They had faced possible sentences of 95 years in prison and fines of $70,000.
US Justice Department is studying whether to appeal what it considers excessively light sentences given to Texas residents Steven Crawford and Randall Craig Waggnor, who have been convicted of holding 19 Mexican workers in slavery; both testified they bought aliens from broker for $50 each, forced them at gunpoint to live in shack and made them work for no pay and little food; Federal District Judge William M Steger sentenced them to five years' probation and fines (M)
On Monday, Federal District Judge William M. Steger in Tyler, Tex., sentenced the men to five years' probation and fined them $1,000 each. The same sentence was also imposed on a third defendant, Joe Gonzales, who had pleaded guilty and testified for the prosecution.

Judge Faults Border Guards
''We are very, very disappointed in the sentences,'' Criselda Ortiz, a lawyer for the Justice Department's civil rights division, who was prosecutor in the case, said in an interview today. She said Judge Steger did not allow her to recommend a sentence.
Miss Ortiz said Judge Steger contended in court that the fault lay with the United States Immigration and Naturalization Service, which failed to prevent the Mexicans from illegally crossing into this country.
Regarding the possibility of an appeal, Assistant Attorney General William Bradford Reynolds, who heads the civil rights division, said today, ''We are looking at that question, but at the present time it does not appear to be an option that's available to us.''
The Government is virtually barred under the law from appealing a sentence. Any appeal would have to focus not on the sentences imposed by Judge Steger, but on his refusal to allow Miss Ortiz to make a statement regarding the Government's views on the possible sentences for the defendants.

Rules Permit Statement
Under the Federal Rules of Criminal Procedure the defendant must be permitted to speak ''to present any information in mitigation of punishment,'' his lawyer must be permitted to speak on his behalf, and ''the attorney for the Government shall have an equivalent opportunity to speak to the court.''
''I had no chance to make a recommendation,'' Miss Ortiz said. ''The lawyers for Crawford and Waggnor spoke, but I was prohibited. The record will show that Judge Steger threatened to hold me in contempt if I persisted in speaking. I tried to speak several times and he ordered me not to.''
Judge Steger, a 63-year-old Republican who was named to the Federal District Court bench for eastern Texas in 1970, could not be reached for comment today. His secretary, Evelyn Walker, said, ''I don't believe he would care to comment,'' adding that he had declined other inquiries. ''He is ill at home,'' she said, ''and cannot be reached.''
But Weldon Holcomb, Mr. Crawford's lawyer, said, ''I believe this was the proper sentence, based on all the facts and circumstances surrounding the case.''

'Trying to Get Ahead'
Mr. Holcomb noted that Mr. Crawford was 21 years old, and Mr. Waggnor 22, a factor he said the judge had considered.
''He was trying to get ahead,'' Mr. Holcomb said of his client. ''The young men just used bad judgment.''
But Mr. Holcomb was critical of Mr. Gonzales, saying it had been disclosed during the trial that the Government's witness had acted as a ''human broker'' several times before, in other parts of the state.
''The Mexicans on the border just sell these people like cattle,'' the lawyer said.
The Mexicans, all illegal aliens who had crossed the border in search of employment, had agreed to work in the defendants' pine tree planting business in exchange for $25 a day plus room and board.
They were kept, sometimes at rifle point, in an unheated, 14-by-20-foot shack without windows, sufficient beds or blankets, or any bathroom or toilet facilities, Miss Ortiz said. When some risked escape, she said, they were recaptured at gunpoint.
According to Miss Ortiz, the case began on Feb. 10, 1983, when Mr. Gonzales gathered the 19 Mexicans, ranging in age from 16 to 48, in Rocksprings, Tex. He had arranged for them to work for Mr. Crawford, who held contracts with the State Department of Forestry to plant pine trees in Center, Tex., near the border with Louisiana.
According to Miss Ortiz, Mr. Waggnor paid Mr. Gonzales $950 for the aliens.  She said Mr. Waggnor placed them in a 5-foot-by-8-foot trailer where she said they were so crowded they had no room to sit down. They drove for 500 miles, she said, and when they arrived were put immediately to work. ''They were told they had to work two weeks without pay in order to pay for their ride to the farm,'' Miss Ortiz said.
After several days of being forced to work at gunpoint, the aliens escaped and persuaded a shopkeeper to call the police.  The Immigration and Naturalization Service, the Department of Labor, the Federal Bureau of Investigation, and the United States Attorney's office for the Eastern District of Texas were all called into the case.
Miss Ortiz recalled that the jury deliberated for just 90 minutes before it convicted Mr. Crawford and Mr. Waggnor.
All the Mexican workers involved will be deported.
Classification


Language: ENGLISH
Subject: NEGATIVE PERSONAL NEWS (94%); JUSTICE DEPARTMENTS (92%); CRIMINAL CONVICTIONS (91%); APPEALS (90%); FINES & PENALTIES (90%); JUDGES (90%); JURY TRIALS (90%); LAW ENFORCEMENT (90%); PROBATION (90%); SENTENCING (90%); SLAVERY (90%); TESTIMONY (90%); VERDICTS (90%); CIVIL RIGHTS (89%); HUMAN RIGHTS VIOLATIONS (89%); LAWYERS (89%); US FEDERAL GOVERNMENT (89%); NEGATIVE MISC NEWS (88%); ATTORNEYS GENERAL (78%); CORRECTIONS (78%); CRIME, LAW ENFORCEMENT & CORRECTIONS (78%); CRIMINAL FINES (78%); GUILTY PLEAS (78%); JAIL SENTENCING (78%); LAW COURTS & TRIBUNALS (78%); NEGATIVE CRIME & LEGAL NEWS (78%); NEGATIVE NEWS (78%); PUBLIC PROSECUTORS (78%); ILLEGAL IMMIGRANTS (77%); IMMIGRATION (77%); TRIAL & PROCEDURE (77%); CITIZENSHIP (76%); CRIMINAL LAW (75%); PRISONS (74%); INTERVIEWS (73%); BORDER CONTROL (70%)
Company: US DEPARTMENT OF JUSTICE   (96%);  US DEPARTMENT OF JUSTICE  (96%);  US CITIZENSHIP & IMMIGRATION SERVICES  (54%)
Organization: US DEPARTMENT OF JUSTICE   (96%);  US DEPARTMENT OF JUSTICE  (96%);  US CITIZENSHIP & IMMIGRATION SERVICES  (54%); US DEPARTMENT OF JUSTICE   (96%);  US DEPARTMENT OF JUSTICE  (96%);  US CITIZENSHIP & IMMIGRATION SERVICES  (54%)
Industry: LAWYERS (89%); ATTORNEYS GENERAL (78%); PUBLIC PROSECUTORS (78%)
Geographic: TEXAS, USA (94%); UNITED STATES (92%)

End of Document",7245,downloads\batch_02\JUSTICE DEPT. CONSIDERS POSSIBLE APPEAL OF SENTENCES IN TEXAS SLAVE CASE.DOCX,filename,"{""annotator3"": [5, 7], ""annotator9"": [5, 7, 9]}","{""annotator14"": [""pro""], ""annotator17"": [""pro""]}"
Immigration1.0-35816,MAZZOLI BILL IS NOT HELPING AT HOME,1984,6,new york times,By JAMES BARRON,section a,698.0,"One thing about a city 373 miles from the nearest foreign border is that immigration is not a hot topic on the local cocktail circuit. So while Representative Romano L. Mazzoli, a Democrat, has been in the news for writing the immigration bill the House passed last week, his constituents here have been talking about Cissy and the college degrees.
Cissy is the nickname for Elaine Musselman, a 40-year-old Republican whose aggressive campaign against Mr. Mazzoli had attracted Democrats and women. They did not see much value for the district in Mr. Mazzoli's immigration work, his first major piece of legislation in 14 years in the House, and did not share his strong antiabortion views.
Article on campaign between Rep Romano L Mazzoli, who wrote immigration reform legisation, and Elaine Musselman, Republican who is challenging him for House seat in Louisville, Ky, election; Musselman has attracted attention because of disclosure that she never received two college degrees she said she held; illustrations (M)
But three weeks ago a television station disclosed that Miss Musselman, the head of an insurance company who is a former president of the Louisville Chamber of Commerce, had never received the two college degrees she had said she held.
That same week, after attending a fund-raising party in Washington, she lost control of a rented automobile she was driving and suffered a concussion and a neck injury.

A Lull in Campaign
With Mr. Mazzoli in Washington to shepherd the immigration bill through the House and Miss Musselman recuperating out of town, there was a lull in the campaign that lasted until today, when Miss Musselman came home for the first time since the accident.
In a statement to 50 supporters at the Louisville airport, she called her misstatements about her educational background ''a foolish and immature mistake'' that she had made to get her first job, as a lobbyist with the Bristol- Myers Company in Washington. She said the company had kept her on the payroll after discovering that she did not have a bachelor of arts degree from the University of Louisville and a masters in international relations from American University in Washington, as she had asserted.
Saul Loeb, her campaign spokesman, said that she had not decided whether to continue the race and that her decision would depend on her health.
''Everything that's happened has brought back Ron's basic virtues,'' said Russell Riggs, a Louisville lawyer who is a former local Democratic chairman. ''His hard work didn't appeal to trendy people, and he'd lost some of them.''
The district hugs the Ohio River and includes this city of Louisville and the powerful, wealthy suburbs to the east, where Democratic voters outnumber Republicans by 3 to 1. Mr. Mazzoli, who is 51 years old, won his seat in 1970 by running as the peace candidate in what was seen as a referendum on the Vietnam War.

Stand on Rights Amendment
Mr. Mazzoli is a Roman Catholic and has consistently opposed abortion. But until last year he had generally supported the proposed equal rights amendment to the Federal Constitution. Karen Bybee, his spokesman in Washington, said he cast a no vote last November because he disapproved of the procedures used to bring the amendment to the floor.
''When he voted against the E.R.A., a lot of women were disturbed,'' said Lucretia Ward, coordinator of the 1,500-member Women's Alliance, who is a member of the Kentucky Commission on Women.
As for immigration, some of Mr. Mazzoli's constituents are not sure that the Government can administer Mr. Mazzoli's bill. ''It sounds like it will be a real bureaucratic wingding,'' said Betty Ann Miller, a Democrat.
His sudden national prominence has made some people in Louisville wonder whether he is more in touch with affairs in Washington than with his district. ''I don't care how many weekends you fly back,'' Mr. Riggs said, ''it's not like living there.''
Miss Musselman, by contrast, had become a visible community leader and was planning a well-financed campaign. Mr. Loeb said she had expected to raise $500,000. Whether she can raise that much now is an open question. So is whether she can still defeat Mr. Mazzoli.
''The public has an enormous capacity to forgive, but this is like the Tylenol case,'' said Jessica Schikler, a partner in a Louisville advertising company who was an early Musselman supporter. To turn something like this around takes great skill and total honesty.''
Graphic


photo of Romano L. Mazzoli; photo of Elaine Musselman
Classification


Language: ENGLISH
Subject: IMMIGRATION (93%); CERTIFICATES, DEGREES & DIPLOMAS (90%); IMMIGRATION REGULATION & POLICY (90%); US DEMOCRATIC PARTY (90%); US REPUBLICAN PARTY (90%); IMMIGRATION REFORM (89%); POLITICAL PARTIES (89%); IMMIGRATION LAW (78%); INTERNATIONAL RELATIONS & NATIONAL SECURITY (78%); LEGISLATION (78%); ELECTIONS & POLITICS (77%); LOBBYING (77%); FUNDRAISING (76%); CONCUSSIONS (72%); VOTERS & VOTING (72%); WOUNDS & INJURIES (70%); BRAIN INJURIES (65%); NECK DISORDERS & INJURIES (64%); CHAMBERS OF COMMERCE (51%)
Company: BRISTOL-MYERS CO PTY LTD  (53%); CONGRESS (US); HOUSE OF REPRESENTATIVES (US)  BRISTOL-MYERS CO PTY LTD  (53%);  HOUSE OF REPRESENTATIVES (US)  BRISTOL-MYERS CO PTY LTD  (53%)
Organization: CONGRESS (US); HOUSE OF REPRESENTATIVES (US)
Industry: TELEVISION INDUSTRY (52%)
Geographic: LOUISVILLE, KY, USA (94%); KENTUCKY, USA (93%); UNITED STATES (94%)

End of Document",5452,downloads\batch_02\MAZZOLI BILL IS NOT HELPING AT HOME.DOCX,filename,"{""annotator3"": [13], ""annotator6"": [6, 9, 13]}","{""annotator15"": [""neutral""], ""annotator3"": [""neutral""]}"
Immigration1.0-35037,MEXICANS OPPOSE U.S. ENTRY CURBS,1982,11,new york times,"By ROBERT PEAR, Special to the New York Times",section 1,893.0,"Business and political leaders in Mexico have told the United States that passage of a comprehensive immigration bill now pending in Congress would seriously harm relations between the two countries and ''foster political unrest'' if it was effectively enforced.
In a dispatch to Washington, the United States Ambassador to Mexico, John Gavin, said it was the unanimous opinion of Mexican leaders interviewed by the embassy that the consequences of the legislation would be ''highly unfavorable for the U.S. economy and for U.S.-Mexican relations.''
Illegal aliens sent back to Mexico and would-be migrants unable to cross the border ''would foster political unrest with potentially explosive consequences, businessmen here told us,'' Mr. Gavin reported.
With the Mexican economy in distress, the peso in turmoil and a new President set to take office on Dec. 1, Mr. Gavin said, many Mexicans believe this would be a particularly inauspicious time for the United States to tighten its immigration law.
WASHINGTON, Nov. 20 - Business and political leaders in Mexico have told the United States that passage of a comprehensive immigration bill now pending in Congress would seriously harm relations between the two countries and ''foster political unrest'' if it was effectively enforced.Bill Awaits House Action
The bill, sponsored by Senator Alan K. Simpson, Republican of Wyoming, and Representative Romano L. Mazzoli, a Kentucky Democrat, has passed the Senate and is awaiting possible House floor action in the special session of Congress that starts Nov. 29.
Supporters of the bill, seizing on concern over unemployment, say it would open one million to two million jobs for American citizens.  The heart of the bill is a system of fines and prison terms for employers who knowingly hire illegal aliens. The bill would also offer legal status to several million illegal aliens who entered the United States before 1980.
''Probably between one and two million Mexicans would be forced to return to Mexico at the one moment'' in its history when ''Mexico is least capable of generating additional employment,'' Mr. Gavin wrote.
The ambassador's 17-page report drew on conversations with Mexican officials, businessmen, economists, journalists and academics, including ''scholars affiliated with the Government.''
The State Department's chief spokesman on immigration, Assistant Secretary Diego C. Asencio, said in an interview Friday that ''we've been talking to the Mexicans, we've been listening to them and we have attempted to take their concerns into account as much as we could.'' The Reagan Administration has strongly supported the bill, saying it would permit the United States to re-establish control of its borders.

Patrols Would Be Increased
The bill declares the sense of Congress that there should be a carefully controlled ''increase in border patrol and other enforcement activities of the Immigration and Naturalization Service.'' But from Mexico, Mr. Gavin reported that ''effective enforcement of this measure is seen to require authoritarian measures amounting to a militarization of the border zone.''
If there is a substantial reduction in money sent home by Mexican workers in the United States, Mr. Gavin said, the standard of living in some agricultural regions of Mexico could ''plummet to belowsubsistence levels.''
''At the national level,'' he said, ''lower remittance incomes would deplete the Bank of Mexico's dollar reserves and aggravate mounting debt payment difficulties.'' By further depressing the value of the peso, he said, ''these developments would fuel inflation, which in 1982 has risen to the highest levels'' in 50 years.
Some Mexicans contend that the ''economic dislocations'' would be ''more damaging to the United States than to Mexico,'' Mr. Gavin said. According to this view, ''border zone employers, already suffering sizable market losses due to this summer's devaluations, would be dealt the additional blow of losing their principal source of low-wage labor.''

'Second-Class Citizenship' Seen
Mr. Simpson and Mr. Mazzoli say that by granting amnesty to illegal aliens, they would eliminate an illegal subclass of people who have been exploited by American employers. But Mr. Gavin said this proposal was seen as ratifying ''second-class citizenship for Mexicans,'' because they would have to pay taxes in the United States while being ineligible for most social welfare benefits.
United States officials said that Mr. Gavin's description of Mexican attitudes was invaluable because, as the ambassador said, the official Mexican policy on illegal migration has been a ''policy of silence.''
Mexicans ''see the migration problem as deeply embedded in the structure of an international labor market that unites the two countries,'' Mr. Gavin said. ''These economic forces, characterized as a 'push' from Mexico and a much stronger 'pull' from the United States, defy legal attempts to modify them.''
Thus, he said, ''Mexicans are deeply pessimistic that Simpson-Mazzoli can be enforced.'' They ''commonly assume that the U.S. economy's demand for foreign labor is ineradicable, even in a recession; and many maintain a Marxist world-view leading them to believe business interests dominate Congress, and thus would never allow Congress to pass or enforce stiff employer sanctions.''
Classification


Language: ENGLISH
Subject: IMMIGRATION (92%); INTERNATIONAL RELATIONS & NATIONAL SECURITY (91%); NEGATIVE POLITICAL NEWS (91%); ELECTIONS & POLITICS (90%); FOREIGN RELATIONS (90%); IMMIGRATION REGULATION & POLICY (90%); INTERNATIONAL RELATIONS (90%); LEGISLATION (90%); LEGISLATIVE BODIES (90%); PENDING LEGISLATION (90%); BORDER CONTROL (89%); EMBASSIES & CONSULATES (89%); ILLEGAL IMMIGRANTS (89%); INTERVIEWS (89%); TERRITORIAL & NATIONAL BORDERS (89%); US DEMOCRATIC PARTY (79%); US REPUBLICAN PARTY (79%); FOREIGN LABOR (78%); IMMIGRATION LAW (78%); SPECIAL INVESTIGATIVE FORCES (78%); STATE DEPARTMENTS & FOREIGN SERVICES (78%); US PRESIDENTS (78%); LAW ENFORCEMENT (77%); ECONOMIC CONDITIONS (75%); ECONOMY & ECONOMIC INDICATORS (75%); GOVERNMENT DEPARTMENTS & AUTHORITIES (73%); ECONOMICS (70%); EMPLOYMENT GROWTH (68%); NEGATIVE EMPLOYMENT NEWS (63%); WRITERS (60%); CRIMINAL FINES (50%)
Industry: WRITERS (60%)
Geographic: KENTUCKY, USA (79%); UNITED STATES (98%); MEXICO (97%)

End of Document",6361,downloads\batch_02\MEXICANS OPPOSE U.S. ENTRY CURBS.DOCX,filename,"{""annotator0"": [1, 6, 13, 14], ""annotator9"": [1, 6, 13, 14]}","{""annotator0"": [""anti""], ""annotator15"": [""anti""]}"
